{
  "event_id": "evt_6d5c4b3a291807f6e5d4c3b2a1908f7e",
  "event_type": "platform.contract.example",
  "schema_version": 1,
  "occurred_at": "2026-10-07T09:00:00Z",
  "producer_service": "cfmeet.calling",
  "runtime_environment": "staging",
  "correlation_id": "corr_0a1b2c3d4e5f60718293a4b5c6d7e8f9",
  "causation_id": "evt_00112233445566778899aabbccddeeff",
  "ownership": {
    "tenant_id": "3f0f4c1e-6a7b-4c2d-9e8f-0a1b2c3d4e5f",
    "application_id": "7c9e6679-7425-40de-944b-e07fc1f90ae7",
    "application_environment_id": "9b2e3c4d-5f60-4718-8a9b-0c1d2e3f4a5b"
  },
  "payload": {
    "note": "envelope shape fixture; no event payload contracts exist yet"
  }
}
