{
  "event_id": "evt_0123456789abcdef0123456789abcdef",
  "event_type": "number.restored",
  "schema_version": 1,
  "occurred_at": "2031-03-01T10:05:00.000000Z",
  "producer_service": "cfmeet.numbering",
  "runtime_environment": "staging",
  "correlation_id": "corr_0123456789abcdef0123456789abcdef",
  "payload": {
    "number_resource_id": "6f1a2b3c-4d5e-4f60-8a7b-9c0d1e2f3a4b",
    "assignment_id": "1e7f3b5d-0c2a-4d4e-9f6b-3a8c0d2e4f6a",
    "suspension_id": "7a8b9c0d-1e2f-4a3b-8c4d-5e6f7a8b9c0d",
    "source": "ORGANIZATION",
    "reason_code": "CUSTOMER_REQUEST",
    "provider_state": "CONFIRMED",
    "status": "RESTORED"
  },
  "ownership": {
    "tenant_id": "2b4d6f8a-1c3e-4a5b-8c7d-9e0f1a2b3c4d",
    "application_id": "3c5e7a9b-2d4f-4b6c-9d8e-0f1a2b3c4d5e",
    "application_environment_id": "4d6f8b0c-3e5a-4c7d-8e9f-1a2b3c4d5e6f"
  }
}
