{
  "event_id": "evt_0123456789abcdef0123456789abcdef",
  "event_type": "number.resource.classified",
  "schema_version": 1,
  "occurred_at": "2031-03-01T10:05:00.000000Z",
  "producer_service": "cfmeet.numbering",
  "runtime_environment": "staging",
  "correlation_id": "corr_0123456789abcdef0123456789abcdef",
  "payload": {
    "number_resource_id": "5f0b2c1e-8d3a-4b6f-9e2d-7a1c3b5d9f01",
    "number_type": "MOBILE",
    "classification_source": "PROVIDER_INVENTORY",
    "revision": 3
  },
  "causation_id": "req_0123456789abcdef0123456789abcdef"
}
