{
  "event_id": "evt_0123456789abcdef0123456789abcdef",
  "event_type": "number.relay-lease.changed",
  "schema_version": 1,
  "occurred_at": "2031-03-01T10:05:00.000000Z",
  "producer_service": "cfmeet.numbering",
  "runtime_environment": "staging",
  "correlation_id": "corr_0123456789abcdef0123456789abcdef",
  "payload": {
    "number_resource_id": "6f1a2b3c-4d5e-4f60-8a7b-9c0d1e2f3a4b",
    "relay_inventory_ref": "4e5f6a7b-8c9d-4e0f-9a1b-2c3d4e5f6a7b",
    "lease_id": "5f6a7b8c-9d0e-4f1a-8b2c-3d4e5f6a7b8c",
    "generation": 4,
    "status": "ACTIVE",
    "end_reason": null
  }
}
