{
  "event_id": "evt_0123456789abcdef0123456789abcdef",
  "event_type": "number.pool.changed",
  "schema_version": 1,
  "occurred_at": "2031-03-01T10:05:00.000000Z",
  "producer_service": "cfmeet.numbering",
  "runtime_environment": "staging",
  "correlation_id": "corr_0123456789abcdef0123456789abcdef",
  "payload": {
    "pool_id": "4b0c6e8a-3f5d-4a7b-8c9d-6e1f3a5b7c9d",
    "change": "MEMBER_ADDED",
    "assignment_id": "1e7f3b5d-0c2a-4d4e-9f6b-3a8c0d2e4f6a",
    "revision": 1,
    "status": "ACTIVE"
  }
}
